{
  "$schema": "../../../schemas/records/service.schema.json",
  "schema_version": "1.0.0",
  "id": "service.aurelia_compatibility_support",
  "record_type": "service",
  "data": {
    "id": "service.aurelia_compatibility_support",
    "name": "Aurelia compatibility engineering support",
    "category": "compatibility_engineering",
    "introduced": {
      "event_name": "COMDEX 1979 — Aurelia+ and compatibility kit launch",
      "event_start_date": "1979-12-03"
    },
    "includes": [
      "Ten remote engineering hours by correspondence or telephone",
      "Documentation and test-suite updates during subscription",
      "Extra hours, media conversion and site visits quoted separately; no unlimited support"
    ],
    "delivery_unit": "one manufacturer-year",
    "engineering_hours": 10,
    "commercial_policy": "Optional standard agreement; implementation is not conditional on purchase. AION-funded ports, proprietary source access and OEM application redistribution require separate agreements."
  }
}
