{
  "$schema": "../../../schemas/records/service.schema.json",
  "schema_version": "1.0.0",
  "id": "service.professional_support",
  "record_type": "service",
  "data": {
    "id": "service.professional_support",
    "name": "Logix Professional Support Service",
    "category": "support",
    "features": [
      "Regular Support features",
      "preferential repair turnaround",
      "discounted training",
      "advance notice of new products",
      "priority telephone queue"
    ],
    "pricing_history_usd_per_year": [
      {
        "era": "Aurelia / 1978",
        "price": 249
      },
      {
        "era": "Artemis / 1980",
        "price": 299
      }
    ],
    "introduced": {
      "event_name": "NCC 1978 — Logix Aurelia launch",
      "event_start_date": "1978-06-05"
    }
  }
}
