{
  "$schema": "../../../schemas/records/service.schema.json",
  "schema_version": "1.0.0",
  "id": "service.artemis_commercial_developer_license",
  "record_type": "service",
  "data": {
    "id": "service.artemis_commercial_developer_license",
    "name": "Logix Artemis Commercial Developer License",
    "category": "developer_program_and_license",
    "includes": [
      "software.artemis_sdk",
      "permission to distribute Artemis-compatible software",
      "ROM/cartridge certification guidelines",
      "developer identification number",
      "ability to submit products for Artemis Compatible designation"
    ],
    "introduced": {
      "event_name": "NCC 1980 — Logix Artemis launch",
      "event_start_date": "1980-05-19"
    }
  }
}
