{
  "$schema": "../../../schemas/records/service.schema.json",
  "schema_version": "1.0.0",
  "id": "service.bpi_training",
  "record_type": "service",
  "data": {
    "id": "service.bpi_training",
    "name": "BPI Products training",
    "category": "training",
    "delivery": "Logix Computer Academy teaches BPI-authorised courses under a cooperation agreement; BPI retains software and specialist support. Start June 12, 1978.",
    "introduced": {
      "event_name": "BPI training and direct sales begin",
      "event_start_date": "1978-06-12",
      "date_precision": "day"
    },
    "availability_note": "BPI courses and direct sales begin June 12, 1978, after the NCC premiere; this is separate from the March Academy establishment and June 5 five-city public announcement."
  }
}
